{
  "$schema": "https://json-schema.org/draft/2020-12/schema",
  "$id": "https://kg-benchmark.local/schemas/artifact_lineage.schema.json",
  "title": "KG Artifact Lineage Manifest",
  "type": "object",
  "additionalProperties": false,
  "required": ["manifest_type", "manifest_version", "created_at_utc", "git_revision", "artifacts", "source_provenance", "validation"],
  "properties": {
    "manifest_type": {"const": "kg_artifact_lineage"},
    "manifest_version": {"const": 2},
    "created_at_utc": {"type": "string", "format": "date-time"},
    "git_revision": {"type": ["string", "null"]},
    "artifacts": {
      "type": "object",
      "required": ["stage0", "stage1", "stage2_json", "stage2_jsonl", "stage3", "stage4"],
      "additionalProperties": {"$ref": "#/$defs/artifact"}
    },
    "source_provenance": {"type": "array", "items": {"type": "object"}},
    "validation": {
      "type": "object",
      "required": ["passed", "stage2_representation_equivalence", "stage0_stage1_provenance", "stage234_identity_and_projection"],
      "properties": {
        "passed": {"type": "boolean"},
        "stage2_representation_equivalence": {"type": "object"},
        "stage0_stage1_provenance": {"type": "object"},
        "stage234_identity_and_projection": {"type": "object"}
      }
    }
  },
  "$defs": {
    "artifact": {
      "type": "object",
      "additionalProperties": false,
      "required": ["path", "size_bytes", "sha256", "record_count"],
      "properties": {
        "path": {"type": "string", "minLength": 1},
        "size_bytes": {"type": "integer", "minimum": 0},
        "sha256": {"type": "string", "pattern": "^[0-9a-f]{64}$"},
        "record_count": {"type": "integer", "minimum": 0}
      }
    }
  }
}
